{
  "$schema": "./asset-rights-registry.schema.json",
  "version": 1,
  "canonicalRoot": "public",
  "generatedAt": "2026-08-16",
  "records": [
    {
      "id": "english-ipa-audio",
      "path": "audio/ipa/**/*.mp3",
      "sha256": "2596ec7de769b054fbbe57a8e28a3d979b1f8f48e52b7e4918919fb55b5a3809",
      "assetCount": 120,
      "kind": "audio",
      "sourceName": "American IPA Chart and documented Wikimedia Commons replacements",
      "sourceUrl": "https://americanipachart.com/",
      "creator": "American IPA Chart contributors; Dvortygirl; RoachPeter",
      "licenseSpdx": "LicenseRef-SpeakRight-IPA-Redistribution AND CC-BY-SA-3.0 AND CC-BY-SA-4.0",
      "evidenceRef": "SR-EVIDENCE-2026-IPA-AUDIO-001",
      "redistribution": "restricted-bundle",
      "modifications": "Downloaded source audio; documented cup clips were trimmed, converted, faded, level-matched, or time-stretched as recorded in the source ledger.",
      "attribution": "See THIRD_PARTY_NOTICES.md and docs/operations/GUIDED_REPEAT_AUDIO_SOURCES.md.",
      "editions": ["browser", "desktop"],
      "reviewedAt": "2026-08-16"
    },
    {
      "id": "elevenlabs-english-word-audio",
      "path": "audio/words/**/*.mp3",
      "sha256": "d4889f648f0b274c175e34911243970840ae62c898ee5fadb753790247c548e4",
      "assetCount": 1763,
      "kind": "audio",
      "sourceName": "ElevenLabs generated SpeakRight word audio",
      "sourceUrl": "https://elevenlabs.io/",
      "creator": "SpeakRight maintainer using configured ElevenLabs voices",
      "licenseSpdx": "LicenseRef-ElevenLabs-Generated-Output",
      "evidenceRef": "SR-EVIDENCE-2026-ELEVENLABS-OUTPUTS-001",
      "redistribution": "restricted-bundle",
      "modifications": "Generated for SpeakRight and normalized where recorded by the audio audit.",
      "attribution": "Generated with ElevenLabs; no affiliation or endorsement implied.",
      "editions": ["browser", "desktop"],
      "reviewedAt": "2026-08-16"
    },
    {
      "id": "elevenlabs-language-packs",
      "path": "audio/language-packs/**/*.mp3",
      "sha256": "fc50d68ca6469199d3d1b376d31ef9e79101e0c731c87d09047563ee73973dd0",
      "assetCount": 4218,
      "kind": "audio",
      "sourceName": "ElevenLabs generated multilingual language packs",
      "sourceUrl": "https://elevenlabs.io/",
      "creator": "SpeakRight maintainer using configured ElevenLabs voices",
      "licenseSpdx": "LicenseRef-ElevenLabs-Generated-Output",
      "evidenceRef": "SR-EVIDENCE-2026-ELEVENLABS-OUTPUTS-001",
      "redistribution": "restricted-bundle",
      "modifications": "Generated for SpeakRight; selected assets were loudness-normalized as recorded by the audit manifests.",
      "attribution": "Generated with ElevenLabs; no affiliation or endorsement implied.",
      "editions": ["browser", "desktop"],
      "reviewedAt": "2026-08-16"
    },
    {
      "id": "spanish-header-audio",
      "path": "audio/language-assets/es-ES/**/*.m4a",
      "sha256": "0598618de360d331cfce3fdb7f3a3e5267b4e4049766b744911db5ce5127b0ec",
      "assetCount": 29,
      "kind": "audio",
      "sourceName": "University of Iowa Sounds of Speech Spanish",
      "sourceUrl": "https://soundsofspeech.uiowa.edu/spanish",
      "creator": "University of Iowa Sounds of Speech",
      "licenseSpdx": "LicenseRef-SpeakRight-Iowa-Written-Permission",
      "evidenceRef": "SR-EVIDENCE-2026-IOWA-001",
      "redistribution": "restricted-bundle",
      "modifications": "Short audio tracks extracted or prepared for exact sound-unit playback.",
      "attribution": "University of Iowa Sounds of Speech Spanish.",
      "editions": ["browser", "desktop"],
      "reviewedAt": "2026-08-16"
    },
    {
      "id": "french-header-audio",
      "path": "audio/language-assets/fr-FR/**/*.m4a",
      "sha256": "c1a32c38b7e9027c33bbcd72a1bdc3e801e6b60716d4964f4080449f036efef3",
      "assetCount": 35,
      "kind": "audio",
      "sourceName": "Seeing Speech articulation media",
      "sourceUrl": "https://www.seeingspeech.ac.uk/ipa-charts/",
      "creator": "Seeing Speech, University of Glasgow",
      "licenseSpdx": "LicenseRef-SpeakRight-Seeing-Speech-Permission",
      "evidenceRef": "SR-EVIDENCE-2026-SEEING-SPEECH-001",
      "redistribution": "restricted-bundle",
      "modifications": "Audio tracks extracted from corresponding articulation media without changing the source performance.",
      "attribution": "Lawson, Stuart-Smith, Scobbie, and Nakai (2018), Seeing Speech, University of Glasgow.",
      "editions": ["browser", "desktop"],
      "reviewedAt": "2026-08-16"
    },
    {
      "id": "russian-seeing-speech-audio",
      "path": "audio/language-assets/ru-RU/**/*.m4a",
      "sha256": "16c57a607745c1e700be086f375eacc0b58e4eaedca4d79b6e5b4249aad75b37",
      "assetCount": 59,
      "kind": "audio",
      "sourceName": "Russian Seeing Speech and Wikimedia-derived local header audio",
      "sourceUrl": "https://www.seeingspeech.ac.uk/ipa-charts/",
      "creator": "Seeing Speech, University of Glasgow, and per-file Wikimedia Commons contributors",
      "licenseSpdx": "LicenseRef-SpeakRight-Russian-Local-Assets",
      "evidenceRef": "SR-EVIDENCE-2026-RUSSIAN-LOCAL-ASSETS-001",
      "redistribution": "restricted-bundle",
      "modifications": "AAC tracks extracted from corresponding source videos; header clips select the exact locally documented source.",
      "attribution": "See the Russian asset manifest for each header clip's exact source selection and attribution.",
      "editions": ["browser", "desktop"],
      "reviewedAt": "2026-08-16"
    },
    {
      "id": "russian-commons-ogg-audio",
      "path": "audio/language-assets/ru-RU/**/*.ogg",
      "sha256": "358eb773e800dbac2c27326ff708fcc419b69e61e1cc8b84309a46000e1f0363",
      "assetCount": 18,
      "kind": "audio",
      "sourceName": "Wikimedia Commons IPA audio",
      "sourceUrl": "https://commons.wikimedia.org/",
      "sourceDetailsPath": "public/videos/language-assets/ru-RU/russian-local-pronunciation-assets.manifest.json",
      "sourceDetailsSha256": "6d9fe9b8325919a31a361b276f4b0795d3c03a9ff6cb009b74fc36e5a5b9d0bf",
      "creator": "Per-file Wikimedia Commons contributors",
      "licenseSpdx": "CC-BY-SA-3.0 OR CC-BY-SA-4.0",
      "evidenceRef": "SR-EVIDENCE-2026-WIKIMEDIA-RU-001",
      "redistribution": "restricted-bundle",
      "modifications": "Original downloaded audio unless a per-file manifest entry states otherwise.",
      "attribution": "See each sourcePageUrl and attribution in the Russian asset manifest.",
      "editions": ["browser", "desktop"],
      "reviewedAt": "2026-08-16"
    },
    {
      "id": "russian-commons-oga-audio",
      "path": "audio/language-assets/ru-RU/**/*.oga",
      "sha256": "3c0a1f8bbff2a8ba73f172bd2a5d37a61e49ce6776c69fa438740b9cc9b9268a",
      "assetCount": 1,
      "kind": "audio",
      "sourceName": "Wikimedia Commons IPA audio",
      "sourceUrl": "https://commons.wikimedia.org/",
      "sourceDetailsPath": "public/videos/language-assets/ru-RU/russian-local-pronunciation-assets.manifest.json",
      "sourceDetailsSha256": "6d9fe9b8325919a31a361b276f4b0795d3c03a9ff6cb009b74fc36e5a5b9d0bf",
      "creator": "Per-file Wikimedia Commons contributors",
      "licenseSpdx": "CC-BY-SA-3.0 OR CC-BY-SA-4.0",
      "evidenceRef": "SR-EVIDENCE-2026-WIKIMEDIA-RU-001",
      "redistribution": "restricted-bundle",
      "modifications": "Original downloaded audio unless a per-file manifest entry states otherwise.",
      "attribution": "See each sourcePageUrl and attribution in the Russian asset manifest.",
      "editions": ["browser", "desktop"],
      "reviewedAt": "2026-08-16"
    },
    {
      "id": "fluent-emoji-ipa-images",
      "path": "images/ipa/**/*.png",
      "sha256": "5d4f33258a755f2f4171d991b9c368226fbf53b5984a6ca68d102574db010be2",
      "assetCount": 40,
      "kind": "image",
      "sourceName": "Microsoft Fluent Emoji",
      "sourceUrl": "https://github.com/microsoft/fluentui-emoji",
      "creator": "Microsoft Corporation and Fluent Emoji contributors",
      "licenseSpdx": "MIT",
      "evidenceRef": "SPDX-MIT-FLUENT-EMOJI-001",
      "redistribution": "approved",
      "modifications": "Selected 3D PNG exports downloaded and mapped to learning entries.",
      "attribution": "Microsoft Fluent Emoji, MIT License.",
      "editions": ["browser", "desktop"],
      "reviewedAt": "2026-08-16"
    },
    {
      "id": "fluent-emoji-word-images",
      "path": "images/words/**/*.png",
      "sha256": "a2610412048c73ad49867a0c12daa868e1fda8c1cfbbda784dd062f81712833f",
      "assetCount": 90,
      "kind": "image",
      "sourceName": "Microsoft Fluent Emoji",
      "sourceUrl": "https://github.com/microsoft/fluentui-emoji",
      "creator": "Microsoft Corporation and Fluent Emoji contributors",
      "licenseSpdx": "MIT",
      "evidenceRef": "SPDX-MIT-FLUENT-EMOJI-001",
      "redistribution": "approved",
      "modifications": "Selected 3D PNG exports downloaded and mapped to example words.",
      "attribution": "Microsoft Fluent Emoji, MIT License.",
      "editions": ["browser", "desktop"],
      "reviewedAt": "2026-08-16"
    },
    {
      "id": "merriam-webster-mark",
      "path": "images/mw-logo.svg",
      "sha256": "a2a4756bb968675b80e92d2ff3c96485453ae0a7be4ca60be4ba6cd1a7c94527",
      "assetCount": 1,
      "kind": "image",
      "sourceName": "Merriam-Webster provider mark",
      "sourceUrl": "https://www.dictionaryapi.com/",
      "creator": "Merriam-Webster",
      "licenseSpdx": "LicenseRef-Merriam-Webster-Provider-Mark",
      "evidenceRef": "SR-EVIDENCE-2026-MW-MARK-001",
      "redistribution": "restricted-bundle",
      "modifications": "Packaged only for provider identification.",
      "attribution": "Merriam-Webster is a trademark of its owner; no endorsement implied.",
      "editions": ["browser", "desktop"],
      "reviewedAt": "2026-08-16"
    },
    {
      "id": "project-video-poster",